{
  "schema_version": 1,
  "id": "417849ce-340a-4e4a-b917-1be351590ec5",
  "name": "Golden legacy project",
  "revision": 2,
  "profile": {
    "schema_version": 2,
    "id": "417849ce-340a-4e4a-b917-1be351590ec5",
    "name": "Golden legacy project",
    "organizations": [],
    "locations": [],
    "cohorts": [],
    "intents": [],
    "scope_blueprints": [],
    "assignments": [],
    "rollout_stages": [],
    "unresolved": []
  },
  "compiled_plan": null,
  "mappings": [],
  "workspace_refs": [],
  "evidence": [
    {
      "intent_id": "intent.baseline",
      "workspace_id": "workspace-golden",
      "requirement_id": "setting.baseline",
      "kind": "local",
      "profile_digest": "74b317643e29c6b1dff6748ff4914db92af6d9d0f10e458f16a10c9ecfe73c81",
      "policy_revision": "aaaaaaaaaaaaaaaaaaaaaaaaaaaaaaaaaaaaaaaaaaaaaaaaaaaaaaaaaaaaaaaa",
      "artifact_digest": "bbbbbbbbbbbbbbbbbbbbbbbbbbbbbbbbbbbbbbbbbbbbbbbbbbbbbbbbbbbbbbbb",
      "catalog_digest": "cccccccccccccccccccccccccccccccccccccccccccccccccccccccccccccccc"
    }
  ],
  "operations": []
}
